{"admission":{"authorization_basis":"standing_authority_to_admit_recommended_observation_only_br13_knowledge","authorized_by":"Cole","manifest_id":"BR13_CANONICAL_GET_UP_KNOWLEDGE_ADMISSION_V1","manifest_sha256":"sha256:741fff3812c9fb7267ac192e2de3c8354f872410f0dcc0b2bc0490ee6983f7cd","payload_sha256":"sha256:c4e31a451db186c166657f4ebb8b27d63bebaad8bae266de22f1e0a47f04329a","policy":"br13-knowledge-admission-v1"},"applicability":["Checking the exact canonical fixture's semantic prone, transition, and terminal stance observations","Checking declared phase order and exclusive recovery-to-stance handoff for the certified profile"],"authoring_source":{"kind":"admission_manifest_inline","path":"res://data/lab/knowledge/admission_manifests/BR13_canonical_get_up_knowledge_admission_v1.json","sha256":"sha256:741fff3812c9fb7267ac192e2de3c8354f872410f0dcc0b2bc0490ee6983f7cd"},"cell_id":"BR13.0","claim":"In the exact certified BR13.0 fixture, the symmetry-collapsed quadruped profile identifies semantic ventral-contact prone, front-pair and rear-pair distal support, the material sagittal guide, matched zero-command controls, and the only successful recovery-to-stance phase order; invalid or unavailable evidence remains UNKNOWN and the observer and phase supervisor grant no mechanical or guidance authority.","claim_status":"accepted","entry_id":"BR13.0.canonical_get_up_profile_and_phase_order.v1","evidence":{"campaign_sha256":"sha256:e90173e3974c4b50d5d5dcde29761da60c4adbab4890ee57ea87015a892aa797","certification_claim_boundary":"This campaign can certify only the exact source-pinned BR13.0 canonical symmetry-collapsed quadruped profile, semantic prone/transition/stance observation, and successful phase-order scope; BR13.2 static work/reserve preflight and explicit post-trace actuator, contact-dissipation, guide-work, and energy-residual accounting scope; and BR13.4 digest-bound three-seed paired active-recovery and zero-command-control live Godot/Jolt scope. BR13.1 timeout, revocation, forbidden-contact, and exclusive-handoff checks and BR13.3 adversarial profile, scaffold, contact, claim, anatomy, seed, and guidance containment are integrity-only and cannot substitute for a milestone program. The BR13.4 analyzer boundary is verbatim: BR13 paired live Godot/Jolt recovery for one exact symmetry-collapsed quadruped laboratory profile. Each active seed begins in observed semantic ventral-contact prone, establishes ordinary front-pair and rear-pair distal support, raises measured whole-system center of mass with finite paired actuation, hands exclusively from the recovery controller to the stance controller, and completes the declared stance dwell. Each seed is compared with one same-state zero-command control that remains prone. Command receipts, transition-integrated actuator work, residual-inferred contact dissipation, and the material out-of-plane guide impulse/work boundary remain explicit. The positive conclusion is exactly constrained_planar_get_up for this fixture. It establishes no free-3D recovery, morphology transfer, gait, walking, repair, or automatic creature guidance. The material sagittal guide remains part of the experiment, each front or rear rigid strut represents a mirrored limb pair rather than independent left/right limbs, raw contact observations establish no per-foot load allocation, and no result generalizes beyond the exact source-pinned profile, actuator, thresholds, seed set, physics rate, or floor fixture.","certification_id":"br13_20260723T225845Z_897b93c2","decision_id":"BR13_CONSTRAINED_CANONICAL_GET_UP_DECISION_V1","decision_sha256":"sha256:524363ee5ea52bd4f81c3407dd1e5b895fb56cb6027c5ec7f8a8646ef34db95e","family":"br13_certification_program_v1","program":{"cell_id":"BR13.0","claim_scope":"The exact symmetry-collapsed quadruped profile pins semantic ventral-contact prone, stable front-pair and rear-pair distal stance, the sagittal material guide, ordinary unilateral contacts, the three-seed set, and the matched zero-command requirement; the quadruped-specific observer preserves invalid or unavailable evidence as UNKNOWN; and the observation-only phase supervisor permits only the declared successful order while granting no force, torque, repair, or guidance authority.","evidence_role":"milestone","program_id":"BR13_CANONICAL_GET_UP_0_PROFILE_PHASE_ORDER_V1","replicates":[{"attestation":{"algorithm":"hmac-sha256","artifact_count":7,"attested_utc":"2026-07-23T22:58:50Z","key_id":"sha256:89d6e582f28664e93d12085c164cdf8fe40a76b5bfb2e382c9666279cd953a20","receipt_path":"C:/Users/Cole/AppData/Local/SporeSpore/LabTrust/v1/receipts/074a3a0e45f8e5a0051b1615917c6b6d997548ee5dd7e5d1793d24b548f43c36.json","receipt_sha256":"sha256:1f342db8f837e90c81e0936ccf1b2566d9f5b771e30efd9fe9195088302aa49e","trust_mode":"production"},"bundle_id":"br13_20260723T225845Z_897b93c2.BR13_CANONICAL_GET_UP_0_PROFILE_PHASE_ORDER_V1.r1","bundle_path":"C:\\Users\\Cole\\AppData\\Local\\SporeSpore\\LabEvidence\\BR13\\br13_20260723T225845Z_897b93c2\\bundles\\BR13_CANONICAL_GET_UP_0_PROFILE_PHASE_ORDER_V1\\r1","capsule_sha256":"sha256:3e2bec6345c643a27bd2d3ca3c2ab92a827deda2fd45d6276fc441700b383894","checksums_sha256":"sha256:7f9ad1c0bc7dd3abeee8483dc275cdd98644046c70833f0b46510f6f607ef884","manifest_sha256":"sha256:abaeefdea98dbecc56e56664e04944a05a9189c9b04210ad0e2502c2e48e24ef","metrics_sha256":"sha256:4e64f94a245a221dbf319dbe466b718d82ea2de9adf7c0fb19b33aa9915c2253","replicate":1,"source_inventory_sha256":"sha256:45c727f1732261bc8da8afd0ad42e9bbd94a5d6adab3880058f0ded1afa56683","transcript_sha256":"sha256:0275f283132605cd985c75de1a712835752725507eb688a29fd03b0b66f821f4"},{"attestation":{"algorithm":"hmac-sha256","artifact_count":7,"attested_utc":"2026-07-23T22:58:56Z","key_id":"sha256:89d6e582f28664e93d12085c164cdf8fe40a76b5bfb2e382c9666279cd953a20","receipt_path":"C:/Users/Cole/AppData/Local/SporeSpore/LabTrust/v1/receipts/821dc266af341ecf1be560412c0be8860c0c30761c9af0e1328815322ad6bacd.json","receipt_sha256":"sha256:d3fa4df4c0ff07f3b612da77ae915ed4eaad2490992d536e7e0508ee97dd5bfc","trust_mode":"production"},"bundle_id":"br13_20260723T225845Z_897b93c2.BR13_CANONICAL_GET_UP_0_PROFILE_PHASE_ORDER_V1.r2","bundle_path":"C:\\Users\\Cole\\AppData\\Local\\SporeSpore\\LabEvidence\\BR13\\br13_20260723T225845Z_897b93c2\\bundles\\BR13_CANONICAL_GET_UP_0_PROFILE_PHASE_ORDER_V1\\r2","capsule_sha256":"sha256:cfeaeba174ea8a0e34ebd759e75675d744ecdb5c0630c3cbfec12979f0aeba0d","checksums_sha256":"sha256:19c7a1cc944fc7152a5ad9e27ac5f0d09e075c7568f99b3177cb51f1c977a7a0","manifest_sha256":"sha256:1edb9178ebb1e02a8490dcec9141dbb7e794944c73e75f4b8e8863ccd4755655","metrics_sha256":"sha256:bf81e56a31c815daf3ac176539d89fd0579b1ae6840af47a0505b09a1290d55c","replicate":2,"source_inventory_sha256":"sha256:45c727f1732261bc8da8afd0ad42e9bbd94a5d6adab3880058f0ded1afa56683","transcript_sha256":"sha256:0275f283132605cd985c75de1a712835752725507eb688a29fd03b0b66f821f4"}]},"report_bytes":26889,"report_receipt_sha256":"sha256:21593c72a0c39edc64f20aeac3d9461836784033d483c095f1f150f49d028220","report_sha256":"sha256:27e3c39fcd78337fe4f749534e0824b2ba1388dafea0bbd0dbfaf82f127f865e","source_commit_sha":"897b93c2c1094081dd2cf411b99f967770d8c0bc"},"failure_boundaries":["The material sagittal guide remains part of the fixture","Each rigid front or rear strut represents a mirrored limb pair rather than independent left-right limbs","No free-3D recovery, morphology transfer, general standing or bracing, per-foot allocation, step, gait, walking, repair, or automatic guidance is established"],"guidance_policy":{"automatic_application_allowed":false,"automatic_creature_guidance_allowed":false,"mode":"observation_only","unlock_requires":["VALIDATED_CREATURE_GUIDANCE_CONSUMER","CERTIFIED_MORPHOLOGY_TERRAIN_TRANSFER","SEPARATE_GUIDANCE_DECISION"]},"knowledge_class":"milestone_observation","mechanism":"A strict profile binds semantic anatomy and contact observations to a deterministic pose observer. A separate observation-only phase supervisor checks the declared phase order and exclusive handoff without applying force or torque.","minimal_repair_rules":[],"morphology_tags":["canonical_get_up","symmetry_collapsed_quadruped","phase_observer","material_sagittal_guide","observation_only"],"parameter_effects":[],"recorded_utc":"2026-07-23T23:29:00Z","schema":"sporespore.lab.br13_knowledge_entry.v1","scope":"Only the exact fixed profile, mirrored-pair anatomy, semantic contact roles, guide declaration, three-seed set, matched-control requirement, observer thresholds, phase order, engine, source, and BR13.0 claim scope certified by br13_20260723T225845Z_897b93c2.","supersedes":[],"title":"The certified canonical profile preserves semantic prone-to-stance phase order","unknowns":["Whether the phase order remains viable after the material sagittal guide is removed","How independent left-right limbs alter the observer and supervisor contract","Which pose thresholds transfer to other morphologies"]}
